[
  {
    "schema_version": "0.1.0",
    "id": "urn:lex-mx:federal:nom:nom-015-stps-2001:supplement:1",
    "standard_id": "urn:lex-mx:federal:nom:nom-015-stps-2001",
    "sequence": 1,
    "kind": "reference_guide",
    "heading": "GUIA DE REFERENCIA I",
    "legal_character": "explicitly_non_normative",
    "text": "GUIA DE REFERENCIA I\n                                DETERMINACION DEL TIEMPO DE EXPOSICION\n   El contenido de esta guía es un complemento auxiliar para determinar los factores que afectan al POE y\npoder establecer sistemas de control, y no es de cumplimiento obligatorio.\n   Este procedimiento sirve para determinar el tiempo mínimo de recuperación, a través del uso de los\nnomogramas elaborados por Mc Karns y Brief.\n   De la carta psicrométrica:\n   I.1 Para determinar la temperatura de rocío:\n    Se proyectan líneas perpendiculares que inician con los valores de la temperatura de bulbo seco (ts) y la\ntemperatura de bulbo húmedo (tbh) en la escala de la carta psicrométrica. En el punto de intersección se traza\nuna línea recta paralela a la escala de la temperatura de bulbo seco (ts) hasta que ésta cruce con la escala de\nla temperatura de bulbo húmedo (tbh). El punto de intersección se conoce como temperatura del punto\nde rocío.\n   I.2 Para determinar la presión de vapor (Vpa):\n    Se proyecta una línea perpendicular que inicia con el valor de la temperatura de rocío en la carta\npsicrométrica y termina en la escala de la presión de vapor (Vpa) de dicha carta. El punto de intersección se\nconoce como presión de vapor.\n   Del nomograma No.1:\n   I.3 Para determinar la evaporación máxima (Emáx.):\n    Se traza un segmento de recta que inicia con el valor de la velocidad del aire y termina con el valor de la\ntemperatura de rocío, en las escalas del nomograma No. 1. El punto de intersección con la escala de\nla evaporación máxima (Emáx.) en el ambiente de trabajo (o área de recuperación según sea el caso) se\nconoce como Evaporación Máxima.\n   I.4 Para determinar el calor por convección (C):\n   Se traza un segmento de recta que inicia con el valor de la velocidad del aire y concluye en el valor de la\ntemperatura de bulbo seco (ts) en el nomograma No. 1. El punto de intersección se conoce como calor por\nconvección (C).\n   I.5 Para determinar la constante de paso (K):\n   Se traza un segmento de recta que inicia con el valor de la presión de vapor (Vpa) y concluye con el valor\nde la diferencia entre la temperatura de globo (tg) y la temperatura de bulbo seco (ts) en las escalas\nrespectivas del nomograma No. 1. El punto de intersección se conoce como el valor de la constante de\npaso (K).\n   Del nomograma No. 2:\n   I.6 Para determinar la temperatura media radiante (tw):\n    Se traza un segmento de recta que inicia con el valor de la constante de paso K y se concluye con el valor\nde la temperatura de globo, el valor que le corresponde a la temperatura media radiante es el punto donde se\nintersecta la escala de la temperatura media radiante (tw) y el segmento de recta trazado.\n   I.7 Para determinar el calor por radiación (R):\n   Se traza un segmento de recta ascendente que inicia con el valor de la temperatura media radiante y\nconcluye donde se intersecta con la escala de radiación R, como se observa en este nomograma.\n   I.8 Para determinar el valor del metabolismo de la actividad y el intercambio de radiación:\n\f\n\n    Se traza un segmento de recta que inicia con el valor de la temperatura media radiante y concluye con el\nvalor del metabolismo. El punto de intersección como se observa en el nomograma No. 2 es el valor del\nmetabolismo y radiación.\n   I.9 Para determinar la energía requerida (Ereq):\n   Se traza un segmento de recta que inicia con el valor del metabolismo y radiación, mismo que concluye\ncon el valor del calor de convección, en las escalas respectivas del nomograma No. 2. El punto de intersección\nen Ereq se considera como valor de la energía requerida (Ereq).\n\f\n\n\n\n\n   I.10 Para determinar el tiempo de exposición permisible:\n   Se traza una línea recta que una al valor Ereq con el valor de la evaporación disponible (Emáx). El punto por donde cruza la línea se considera como el tiempo de\nexposición permisible.\n   Carta psicrométrica\n   Presión barométrica 1 000 milibares\n   (750 mmHg o 29.53 plg de Hg.).\n                                                                       Carta psicrométrica\n\f\n\n\n\n\n                        1\n\n\n\n\n                    2\n\n\n\n\n                              NOMOGRAMA No.1\n\f\n\n\n\n\n                             NOMOGRAMA No.2\n                        ____________________________",
    "start_char": 42652,
    "end_char": 47266
  }
]
